2021-05-11;2021-06-21;Tiefbauamt, Stadt St.Gallen;;OGD-Koordinationsstelle St.Gallen;opendata@stadt.sg.ch;vierteljährlich;;;;;;;;;;stadt-st-gallen;NonCommercialAllowed-CommercialAllowed-ReferenceRequired;Fussgängerzählungen Stadt St.Gallen (temporäre und periodische Zählungen);"<p><span style=""font-family: inherit; font-size: 0.833rem;"">Der Fussverkehr in der Stadt St.Gallen wird an diversen Querschnitten temporär erhoben. Um Anhaltspunkte zur Entwicklung des Fussverkehrs zu erhalten, ist vorgesehen diese Zählung in regelmässigen Abständen zu wiederholen.</span><br/></p><p><span style=""font-family: inherit; font-size: 0.833rem;"">Aufgrund der verwendeten Zähltechnik werden in Mischverkehrszonen auch Velofahrende und Motorfahrzeuge mitgezählt.<br/><span></span></span></p><p><span style=""font-family: inherit; font-size: 0.833rem;""><b>Nur Fussverkehr</b></span></p><ul><li><span style=""font-family: inherit; font-size: 0.833rem;"">FG Poststrasse 17 Südseite</span></li><li><span style=""font-family: inherit; font-size: 0.833rem;"">FG Poststrasse 18 Nordseite</span></li><li><span style=""font-family: inherit; font-size: 0.833rem;"">Kantiweg Burggraben</span></li><li><span style=""font-family: inherit; font-size: 0.833rem;"">Kantiweg Hst. Theater</span></li><li><span style=""font-family: inherit; font-size: 0.833rem;"">Gutenbergstrasse Bahnhofplatz</span></li></ul><p><span style=""font-family: inherit; font-size: 0.833rem;""><b>Fussverkehr in Mischverkehrszonen</b></span><br/></p><p><span style=""font-family: inherit; font-size: 0.833rem;"">Bei nachfolgenden zwei Querschnitten ist der überwiegende Teil des Aufkommens Fussverkehr. Der Motorfahrzeugverkehr an diesen beiden Querschnitten spielt eine untergeordnete Rolle. Die Zählstellen sind daher bezüglich Fussverkehr nicht ganz genau; für die Beurteilung der Entwicklung des Fussverkehrs sind sie jedoch genügend aussagekräftig.</span></p><ul><li><span style=""font-family: inherit; font-size: 0.833rem;"">Marktgasse 20</span></li><li><span style=""font-family: inherit; font-size: 0.833rem;"">Neugasse 34</span></li></ul>";Mobilität und Verkehr;Verkehr,Fussgänger,Langsamverkehr,Zählung,Passanten,Fussverkehr,Zählstellen;CC BY;https://creativecommons.org/licenses/by/4.0/;de;de;Europe/Zurich;2021-06-15T16:02:47.860000+00:00;False;True;2021-06-15T16:02:47.860000+00:00;2023-12-05T13:52:52.969000+00:00;ch_80_3203;True;St. Gallen;Point;"{""coordinates"": [[[9.380665607750416, 47.42625523824245], [9.37053264118731, 47.42625523824245], [9.37053264118731, 47.42265257053077], [9.380665607750416, 47.42265257053077], [9.380665607750416, 47.42625523824245]]], ""type"": ""Polygon""}";Tiefbauamt, Stadt St.Gallen;;5495;;;;;;;False;;stgallen;2018,2019,2020,2021;;opendata.swiss;fussgangerzahlungen-stadt-stgallen-temporare-und-periodische-zahlungen
2024-03-20;2024-03-20;BKZ Geschäftsstelle;;OGD-Koordinationsstelle St.Gallen;opendata@stadt.sg.ch;irregular;;;;;;;;;;stadt-st-gallen;NonCommercialNotAllowed-CommercialNotAllowed-ReferenceRequired;Lehrplan 21 Kanton St.Gallen;"<p class="""">Dieser Datensatz zeigt den Lehrplan 21 des Kantons St.Gallen. <span style=""color: rgb(68, 68, 68); font-family: DINWeb-Light, sans-serif; font-size: 15px;"">Der Lehrplan beschreibt den bildungspolitisch legitimierten Auftrag der Gesellschaft an die Volksschule. Er legt die Ziele für den Unterricht aller Stufen der Volksschule fest und ist ein Planungsinstrument für Lehrpersonen, Schulen und Bildungsbehörden. Eine detaillierte Beschreibung des Aufbaus ist unter </span><a href=""https://sg.lehrplan.ch/index.php?code=e|100|1"" style=""font-family: sans-serif; font-size: 0.875rem; background-color: rgb(255, 255, 255);"">Lehrplan Volksschule</a> zu finden.</p>";Bildung, Wissenschaft;Lehrplan21,Unterricht,Schule,Start Hack 2024;CC BY;https://creativecommons.org/licenses/by/4.0/;de;de;Europe/Zurich;2024-03-19T18:31:39+00:00;False;False;2024-03-19T18:36:14.403000+00:00;2024-03-20T09:46:21.361000+00:00;ch_80_3203;True;St. Gallen;;;BKZ Geschäftsstelle;https://sg.lehrplan.ch/index.php;6441;;;;;;;False;;stgallen;;;;lehrplan-21-kanton-st-gallen
;;;;;;;;;;;;;;;;swisspost;NonCommercialAllowed-CommercialAllowed-ReferenceRequired;Zugangspunkte Post Stadt St.Gallen;<p>Der vorliegende Datensatz enthält Informationen zu postalischen Dienstleistungen und den Zugangspunkten der Post in der Stadt St.Gallen. Die Informationen sind in 4 Sprachen (deutsch, französisch, italienisch und englisch) abgebildet.</p>;Verwaltung;Zugangspunkt,Dienstleistung,Briefkasten,Briefeinwurf,Filialen,Post;CC BY;https://creativecommons.org/licenses/by/4.0/;de;de;;2019-11-19T11:12:09+00:00;False;False;2021-03-14T22:37:25.356000+00:00;2023-11-17T02:10:37.517000+00:00;ch_80_3203;True;St. Gallen;Point;"{""coordinates"": [[[9.419674566015601, 47.4463481688872], [9.300908194854856, 47.4463481688872], [9.300908194854856, 47.40059798117727], [9.419674566015601, 47.40059798117727], [9.419674566015601, 47.4463481688872]]], ""type"": ""Polygon""}";Die Schweizerische Post;;457;;;;;;;True;;stgallen;;;;zugangspunkte-post
2021-01-05;2021-01-05;Finanzen, Stadt St.Gallen;OGD-Koordinationsstelle St.Gallen;OGD-Koordinationsstelle St.Gallen;opendata@stadt.sg.ch;jährlich;;;;;;;;;;stadt-st-gallen;NonCommercialAllowed-CommercialAllowed-ReferenceRequired;Budget 2021 der Stadt St.Gallen nach Funktionaler Gliederung (English Data);"<p>Der Datensatz zeigt das Budget 2021 der Stadt St.Gallen nach Funktionaler Gliederung. Ebenfalls enthalten sind die Rechnung 2019, das Budget 2020, sowie die Abweichung zum Budget 2021. Eine klickbare Visualisierung des Budgets finden Sie im Tab ""Klickbares Budget"".</p>";Finanzen;Budget,Rechnung,Funktionen,Haushalt;CC BY;https://creativecommons.org/licenses/by/4.0/;de;de,en;;2023-12-05T13:40:55.205000+00:00;True;True;2021-03-21T08:25:34.836000+00:00;2023-12-05T13:40:59.273000+00:00;ch_80_3203;True;St. Gallen;;;Finanzen, Stadt St.Gallen;https://www.stadt.sg.ch/home/verwaltung-politik/demokratie-politik/finanzen.html;4149;;;;;;;False;;stgallen;2019,2020,2021;;opendata.swiss;budget-2021-stadt-stgallen-funktionale-gliederung-english-data
;;Stadt St.Gallen, Tiefbauamt;;OGD-Koordinationsstelle St.Gallen;opendata@stadt.sg.ch;täglich;;;;;;;;;;stadt-st-gallen;NonCommercialAllowed-CommercialAllowed-ReferenceRequired;Hundekotbehälter Stadt St.Gallen;Standorte der Hundekotbehälter;Raum und Umwelt;Robidog;CC BY;https://creativecommons.org/licenses/by/4.0/deed.de;de;de;;2024-01-15T12:31:10+00:00;;;2024-03-20T05:30:30.328000+00:00;2024-03-20T05:30:30.442000+00:00;;;;Point;;Rauminformationszentrum (RIZ) Stadt St.Gallen;https://map.stadt.sg.ch/stadtplan/ext/?lang=de&basemap=sg_av&layers=Hundekotbehaelter;220;;;;;;;False;;stgallen;;;opendata.swiss;hundekotbehalter
2021-01-05;2021-01-05;Finanzen, Stadt St.Gallen;OGD-Koordinationsstelle St.Gallen;OGD-Koordinationsstelle St.Gallen;opendata@stadt.sg.ch;jährlich;;;;;;;;;;stadt-st-gallen;NonCommercialAllowed-CommercialAllowed-ReferenceRequired;Budget 2021 der Stadt St.Gallen nach Artengliederung;"<p>Der Datensatz zeigt das Budget 2021 der Stadt St.Gallen nach Artengliederung. Ebenfalls enthalten sind die Rechnung 2019, das Budget 2020, sowie die Abweichung zum Budget 2021. Eine klickbare Visualisierung des Budgets finden Sie im Tab ""Klickbares Budget""</p>";Finanzen;Budget,Rechnung,Artengliederung,Haushalt;CC BY;https://creativecommons.org/licenses/by/4.0/;de;de;;2023-12-05T13:41:35.211000+00:00;True;True;2021-01-07T10:11:28.244000+00:00;2023-12-05T13:41:38.283000+00:00;ch_80_3203;True;St. Gallen;;;Finanzen, Stadt St.Gallen;https://www.stadt.sg.ch/home/verwaltung-politik/demokratie-politik/finanzen.html;111;;;;;;;False;;stgallen;2019,2020,2021;;opendata.swiss;budget-2021-stadt-stgallen-artengliederung
2023-07-06;2023-07-06;Stadtpolizei (stapo), Stadt St.Gallen;;OGD-Koordinationsstelle St.Gallen;opendata@stadt.sg.ch;;;;;;;;;;;stadtpolizei-stapo-stadt-st-gallen;NonCommercialAllowed-CommercialAllowed-ReferenceRequired;Standorte Strassenreklamen Stadt St.Gallen;"<p>Der Datensatz zeigt von der Stadt St.Gallen definierten Standorte für Strassenreklamen. Weitere Informationen und das Gesuch für Strassenreklamen finden Sie unter: <a href=""https://www.stadt.sg.ch/home/wirtschaft-wohnen/gewerbe-veranstaltungen/Strassenreklamen.html"" target=""_blank"">https://www.stadt.sg.ch/home/wirtschaft-wohnen/gewerbe-veranstaltungen/Strassenreklamen.html</a><a href=""https://www.stadt.sg.ch/home/wirtschaft-arbeit/gewerbe-veranstaltungen/neu-veranstaltungen.html""></a></p>";Öffentliche Ordnung und Sicherheit,Kultur, Medien, Informationsgesellschaft, Sport;Reklame,Plakate,Werbung,Öffentlicher Raum,Bewilligungen;CC BY;https://creativecommons.org/licenses/by/4.0/;de;de;Europe/Zurich;2024-03-07T15:17:08.280000+00:00;True;True;2024-03-07T15:17:08.280000+00:00;2024-03-07T15:17:08.674000+00:00;ch_80_3203;True;St. Gallen;Point;"{""coordinates"": [[[9.419802641496062, 47.43952219840139], [9.319265317171812, 47.43952219840139], [9.319265317171812, 47.40756103768945], [9.419802641496062, 47.40756103768945], [9.419802641496062, 47.43952219840139]]], ""type"": ""Polygon""}";Stadtpolizei (stapo), Stadt St.Gallen;https://www.stadt.sg.ch/home/wirtschaft-wohnen/gewerbe-veranstaltungen/Strassenreklamen.html;11;;;;;;;False;;stgallen;;;;standorte-strassenreklamen-stadt-stgallen
2023-11-28;2023-11-29;St.Galler Stadtwerke (sgsw);;OGD-Koordinationsstelle St.Gallen;opendata@stadt.sg.ch;daily;;;;;;;2023-06-30T22:00:00+00:00;;;stadt-st-gallen;NonCommercialAllowed-CommercialAllowed-ReferenceRequired;CO2 Sensoren in den Innenräumen der Stadtverwaltung St.Gallen;<p>Die Stadt St.Gallen verfügt über CO2 Sensoren in einigen Innenräumen und Sitzungszimmern der Stadtverwaltung. Dieser Datensatz zeigt die Messwerte dieser Sensoren in Echtzeit. Abhängig vom Sensor werden auch noch weitere Werte wie Luftdruck und Anzahl flüchtige organische Stoffe in der Luft angezeigt.<br/></p>;Raum und Umwelt;Real-Time,Sensor,CO2,Temperatur,Feuchtigkeit,Offene Sensordaten,VOC;CC BY;https://creativecommons.org/licenses/by/4.0/;de;de;Europe/Zurich;2024-03-17T23:01:33.651000+00:00;False;True;2024-03-17T23:01:33.651000+00:00;2024-03-19T23:01:47.622000+00:00;;False;;;;St.Galler Stadtwerke (sgsw);;421635;;;;;;;False;;stgallen;2023;;opendata.swiss;co2-sensoren-innenraume-stadt-stgallen
;;Stadt St.Gallen, Tiefbauamt;;OGD-Koordinationsstelle St.Gallen;opendata@stadt.sg.ch;Änderungen werden laufen aktualisiert;;;;;;;;;;stadt-st-gallen;NonCommercialAllowed-CommercialWithPermission-ReferenceRequired;Velo- und Motorradabstellplätze in der Stadt St.Gallen;<p>Der Datensatz zeigt die öffentlichen Veloabstellplätze und Motorradabstellplätze mit der entsprechenden Signalisation und Überdachungseigenschaft.</p>;Mobilität und Verkehr;Velo,Motorräder,Abstellplätze;CC BY;https://creativecommons.org/licenses/by/4.0/deed.de;de;de;;2024-01-15T12:31:05+00:00;;;2024-03-20T05:30:50.013000+00:00;2024-03-20T05:30:50.126000+00:00;;;;Point;;Rauminformationszentrum (RIZ) Stadt St.Gallen;;280;;;;;;;False;;stgallen;;;opendata.swiss;veloabstellplatze
;;;;Ansprechsstelle für Daten;data@sbb.ch;;;;;;;;;;;stadt-st-gallen;NonCommercialAllowed-CommercialAllowed-ReferenceRequired;Haltestellen des öffentlichen Verkehrs im Kanton St.Gallen;"<p>List of all stations in Switzerland. Original&nbsp;https://opentransportdata.swiss/de/dataset/didok&nbsp;</p>";Mobilität und Verkehr;Infrastruktur,Verkehr;https://opendata.swiss/de/dataset?q=haltestelle&organization=bundesamt-fur-verkehr-bav&res_rights=NonCommercialAllowed-CommercialAllowed-ReferenceRequired;;de;de;;2023-12-05T13:39:29.870000+00:00;True;True;2024-02-06T14:16:42+00:00;2024-02-23T02:10:47.979000+00:00;ch_80_3203;True;St. Gallen;Point;"{""coordinates"": [[[9.42430330440402, 47.450225092470646], [9.293891116976738, 47.450225092470646], [9.293891116976738, 47.39785948768258], [9.42430330440402, 47.39785948768258], [9.42430330440402, 47.450225092470646]]], ""type"": ""Polygon""}";SBB Infrastruktur;;210;Bundesamt für Landestopografie swisstopo Office fédéral de topographie swisstopo Ufficio federale di topografia swisstopo Uffizi federal da topografia swisstopo Federal Office of Topography swisstopo;;;;;;True;;stgallen;;;opendata.swiss;haltestelle-didok
2021-11-25;2021-11-25;Finanzen, Stadt St.Gallen;;OGD-Koordinationsstelle St.Gallen;opendata@stadt.sg.ch;jährlich;;;;;;;;;;stadt-st-gallen;NonCommercialAllowed-CommercialAllowed-ReferenceRequired;Kostenstellenplan Stadt St.Gallen (4-stellig);<p>Der Kostenstellenplan zeigt die Kostenstellen der Rechnungslegung der Stadt St.Gallen bis zu den 4-stelligen Konten. Dabei sind die bisheringen Kostenstellen bis zum Budget 2021 ausgewiesen, sowie die neuen Kostenstellen (ab Budget 2022). </p>;Finanzen;Rechnung,Budget;CC BY;https://creativecommons.org/licenses/by/4.0/;de;de;Europe/Zurich;2021-11-23T16:53:18+00:00;False;False;2021-11-25T08:29:21.223000+00:00;2023-12-05T13:50:01.225000+00:00;ch_80_3203;True;St. Gallen;;;Finanzen, Stadt St.Gallen;https://www.stadt.sg.ch/home/verwaltung-politik/demokratie-politik/finanzen.html;193;;;;;;;False;;stgallen;;;opendata.swiss;kostenstellenplan-stadt-stgallen
2024-03-15;;BKZ Geschäftsstelle;;OGD-Koordinationsstelle St.Gallen;opendata@stadt.sg.ch;irregular;;;;;;;;;;stadt-st-gallen;NonCommercialNotAllowed-CommercialNotAllowed-ReferenceRequired;Überfachliche Kompetenzen Lehrplan 21 Kanton St.Gallen;<p>In diesem Datensatz sind die überfachlichen Kompetenzen des Lehrplans 21 des Kantons St.Gallen abgebildet.</p>;Bildung, Wissenschaft;Lehrplan21,Start Hack 2024,Kompetenzen,Schule;CC BY;https://creativecommons.org/licenses/by/4.0/;de;de;Europe/Zurich;2024-03-15T09:32:35+00:00;False;False;2024-03-15T10:16:29.117000+00:00;2024-03-20T09:46:20.644000+00:00;ch_80_3203;True;St. Gallen;;;BKZ Geschäftsstelle;https://sg.lehrplan.ch/index.php;56;;;;;;;False;;stgallen;;;;ueberfachliche-kompetenzen-lehrplan21-kanton-stgallen
2021-09-17;2021-09-17;Eidgenössische Materialprüfungs- und Forschungsanstalt EMPA;OGD-Koordinationsstelle St.Gallen;OGD-Koordinationsstelle St.Gallen;opendata@stadt.sg.ch;keine Aktualisierung vorgesehen;;;;;;;;;;stadt-st-gallen;NonCommercialAllowed-CommercialAllowed-ReferenceRequired;Material- und Energieflüsse Schweiz und St.Gallen (EMPA MATCH) Synthese 2020 Konsum (Tonnen & CO2eq);"<p>Der Datensatz zeigt die Material- und Energieflüsse der Schweiz aus dem MatCH Synthesebericht der Eidgenössische Materialprüfungs- und Forschungsanstalt (EMPA), in dem u.a. die Umweltbelastung (Tonnen &amp; CO2) der Wirtschaftssektoren berechnet wird. </p><p>Der Datensatz wurde aus dem Synthesebericht 2018 erstellt und für die <a href=""https://energydatahackdays.ch/#c2391_self"" target=""_blank"">Energy Hackdays 2021</a> aufbereitet. Daraus entstand eine Anwendung zum Thema ""Klimaneutrale Städte"". Mehr Infos dazu: <a href=""https://energydatahackdays.ch/#c2391_self"" target=""_blank"">https://hack.opendata.ch/project/745</a></p><p>Mehr Infos zum Projekt MatCH und zu den verschiedenen Berichten finden Sie unter folgenden Ressourcen:<br/><a href=""https://www.empa.ch/web/s506/care-project-match"" target=""_blank"">MatCH Projekt Informationen</a><br/><a href=""https://www.empa.ch/documents/56122/728861/MatCH_Synthese_Bericht/22c48930-bc8e-4ebc-b899-6e189be39667"" style=""background-color: rgb(255, 255, 255); font-size: 0.875rem;"" target=""_blank"">Bericht - Synthesis: The Swiss Economy</a><br/><a href=""https://www.empa.ch/documents/56122/728861/MatCH_Bericht_Bau_v8_161017.pdf/3a733b91-ab69-43cd-ad81-2b6817716eff"" style=""font-size: 0.875rem; background-color: rgb(255, 255, 255);"" target=""_blank"">Bericht - Building sector</a><span style=""font-family: inherit; font-size: 0.875rem;""> <br/></span><a href=""https://www.empa.ch/documents/56122/728861/MatCH_Mobilitaet_Bericht_170913.pdf/96d1cb72-fdf1-4f0a-af24-214d5e0a452a"" style=""background-color: rgb(255, 255, 255); font-size: 0.875rem;"" target=""_blank"">Bericht - Mobility sector</a><br/><a href=""https://www.empa.ch/documents/56122/728861/MatCH_ProduktionKonsum_Bericht_181024.pdf/ef576a3a-fcfa-4f58-9b21-1f05ff82efbd"" style=""background-color: rgb(255, 255, 255); font-size: 0.875rem;"" target=""_blank"">Bericht - Production and consumption sector</a></p>";Energie,Bau- und Wohnungswesen,Industrie, Dienstleistungen,Raum und Umwelt,Mobilität und Verkehr,Volkswirtschaft;Empa,Material,CO2,Umweltbelastung,Sektor,Energy Hackdays;CC BY;https://creativecommons.org/licenses/by/4.0/;de;de;Europe/Zurich;2021-09-17T13:42:14+00:00;False;False;2021-09-23T07:50:20.860000+00:00;2023-12-05T13:52:32.831000+00:00;ch_80_3203;True;St. Gallen;;;Eidgenössische Materialprüfungs- und Forschungsanstalt EMPA;https://www.empa.ch/web/s506/care-project-match;8092;;;;;;;False;;stgallen;2018;;opendata.swiss;empa-match-synthese-2020-konsum-tonnen-co2
2020-05-22;2020-10-20;Entsorgung St.Gallen (esg);;OGD-Koordinationsstelle St.Gallen;opendata@stadt.sg.ch;jährlich;;;;;;;;;;stadt-st-gallen;NonCommercialAllowed-CommercialAllowed-ReferenceRequired;Abfuhrgebiete Stadt St.Gallen;<p>Der Datensatz zeigt die Abfuhrgebiete der Stadt St.Gallen und deren Abfallkalender in PDF-Format.</p>;Verwaltung;Entsorgung,Abfall,Abfuhr,Kalender,Entsorgungsgebiete;CC BY;https://creativecommons.org/licenses/by/4.0/;de;de;Europe/Zurich;2023-12-30T08:18:15.649000+00:00;True;True;2023-12-30T08:18:15.649000+00:00;2023-12-30T08:18:15.748000+00:00;ch_80_3203;False;St. Gallen;;;Entsorgung St.Gallen (esg);https://www.stadt.sg.ch/home/raum-umwelt/abfall-entsorgung/Abfuhrplan.html;12;;;;;;;False;;stgallen;;;opendata.swiss;abfuhrgebiete-stadt-stgallen
2022-04-13;2022-04-13;OGD-Koordinationsstelle St.Gallen;;OGD-Koordinationsstelle St.Gallen;opendata@stadt.sg.ch;täglich;;;;;;;;;;stadt-st-gallen;NonCommercialAllowed-CommercialAllowed-ReferenceRequired;Mitwirkungen Stadt St.Gallen;<p>Der Datensatz zeigt eine Übersicht über die abgeschlossenen und fertig aufbereiteten Mitwirkungsverfahren der Stadt St.Gallen, welche u.a. auf der digitalen Partizipationsplattform durchgeführt. Neben verschiedenen Informationen zur entsprechenden Mitwirkung enthält der Datensatz auch den Downloadlink zu den verschiedenen Mitwirkungsberichten. </p>;Verwaltung;Partizipation,Beteiligung,Teilhabe,Vernehmlassung;CC BY;https://creativecommons.org/licenses/by/4.0/;de;de;Europe/Zurich;2024-03-14T09:08:20.025000+00:00;True;True;2024-03-14T09:08:20.025000+00:00;2024-03-14T09:08:20.168000+00:00;;False;;Point;"{""coordinates"": [[[9.42066203802824, 47.445229017175734], [9.299811674281955, 47.445229017175734], [9.299811674281955, 47.40263524465263], [9.42066203802824, 47.40263524465263], [9.42066203802824, 47.445229017175734]]], ""type"": ""Polygon""}";OGD-Koordinationsstelle St.Gallen;https://partizipieren.stadt.sg.ch;47;;;;;;;False;;stgallen;;;opendata.swiss;mitwirkungen-stadt-st-gallen
2020-11-19;2020-11-19;Stadtpolizei (stapo), Stadt St.Gallen;Stadt St.Gallen, Geomatik und Vermessung;OGD-Koordinationsstelle St.Gallen;opendata@stadt.sg.ch;unregelmässig;;;;;;;;;;stadt-st-gallen;NonCommercialAllowed-CommercialAllowed-ReferenceRequired;Eventplätze öffentlicher Raum Stadt St.Gallen;"<p>Der Datensatz zeigt die Eventplätze im öffentlichen Raum der Stadt St.Gallen, welche für Veranstaltungen belegt werden können. Die Stadtpolizei St.Gallen unterscheidet zwischen kommerziellen und nicht kommerziellen Veranstaltungen. Diesbezüglich stehen verschiedene Gesuchsformulare zur Verfügung. Vor der Eingabe eines Gesuchs sind die Nutzungsmöglichkeiten sowie die Verfügbarkeit der Eventplätze im Belegungskalender zu prüfen. Weitere Informationen zu Veranstaltungen und Bewilligungen im öffentlichen Raum: <a href=""https://www.stadt.sg.ch/home/wirtschaft-arbeit/gewerbe-veranstaltungen/neu-veranstaltungen.html"" target=""_blank"">https://www.stadt.sg.ch/home/wirtschaft-arbeit/gewerbe-veranstaltungen/neu-veranstaltungen.html</a><a href=""https://www.stadt.sg.ch/home/wirtschaft-arbeit/gewerbe-veranstaltungen/neu-veranstaltungen.html""></a></p>";Öffentliche Ordnung und Sicherheit,Kultur, Medien, Informationsgesellschaft, Sport;Veranstaltungen,Event,Öffentlicher Raum,Bewilligungen,Plätze;CC BY;https://creativecommons.org/licenses/by/4.0/;de;de;Europe/Zurich;2024-03-07T15:10:23.659000+00:00;True;True;2024-03-07T15:10:23.659000+00:00;2024-03-07T15:10:23.774000+00:00;ch_80_3203;True;St. Gallen;MultiPolygon,Polygon;"{""coordinates"": [[[9.377871751785278, 47.42655258625746], [9.370467346161604, 47.42655258625746], [9.370467346161604, 47.42166145239025], [9.377871751785278, 47.42166145239025], [9.377871751785278, 47.42655258625746]]], ""type"": ""Polygon""}";Stadtpolizei (stapo), Stadt St.Gallen;https://www.stadt.sg.ch/home/wirtschaft-arbeit/gewerbe-veranstaltungen/neu-veranstaltungen.html;20;;;;;;;False;;stgallen;;;opendata.swiss;eventplatze-offentlicher-raum-stadt-stgallen
2022-01-31;2022-02-04;Standortförderung, Stadt St.Gallen;;OGD-Koordinationsstelle St.Gallen;opendata@stadt.sg.ch;keine Aktualisierung vorgesehen;;;;;;;2021-12-16T23:00:00+00:00;2022-01-30T23:00:00+00:00;;stadt-st-gallen;NonCommercialAllowed-CommercialAllowed-ReferenceRequired;Sankt Diskurs, Ideenfindung Partizipationsplattform Stadt St.Gallen;"<p>Mit der «Sankt»-Kampagne 2021-2023 hebt die Stadt ihre Stärken und Qualitäten hervor und wirbt damit aktiv für neue Zuzügerinnen und Zuzüger sowie Arbeitnehmende und Firmen. Ende 2020 lud die Standortförderung der Stadt St.Gallen die Bevölkerung dazu ein, am ""Sankt""-Diskurs zur Stadt St.Gallen teilzunehmen und die Gedanken, Meinungen und Wünsche anhand drei gestellten Fragen auf der Partizipationsplattform der Stadt St.Gallen zu teilen:</p><ul><li><span style=""font-family: inherit; font-size: 0.875rem;"">Was zeichnet St.Gallen aus?</span><br/></li><li>Was fehlt in St.Gallen?</li><li>Wie soll St.Gallen in 20 Jahren wahrgenommen werden?</li></ul><p>Der Datensatz zeigt die Beiträge und Kommentare die auf der Partizipationsplattform eingegangen sind.</p>";Verwaltung,Arbeit, Erwerb,Tourismus;Standortförderung,Partizipation,Sankt,Standortmarketing,Kampagne;CC BY;https://creativecommons.org/licenses/by/4.0/;de;de;Europe/Zurich;2024-03-19T23:00:40.360000+00:00;False;True;2024-03-19T23:00:40.360000+00:00;2024-03-19T23:00:40.477000+00:00;ch_80_3203;True;St. Gallen;;;Standortförderung, Stadt St.Gallen;https://www.stadt.sg.ch/home/wirtschaft-wohnen/detailhandel-und-gastronomie/partnerpakete.html;82;;;;;;;False;;stgallen;;;opendata.swiss;sankt-diskurs-ideenfindung-partizipationsplattform-stadt-stgallen
;;;;Ansprechsstelle für Daten;data@sbb.ch;;;alle 2 Jahre;;;;;;;;schweizerische-bundesbahnen-sbb;NonCommercialAllowed-CommercialAllowed-ReferenceRequired;Passagierfrequenz an den Bahnhöfen der Stadt St.Gallen;"In den Zahlen sind die Ein- und Aussteigenden der in «EVU_EF_ITF» angegebenen Eisenbahnverkehrsunternehmen enthalten. Für die grösseren Bahnhöfe ist in den Bemerkungen angegeben, welche Eisenbahntransportunternehmen am jeweiligen Bahnhof nicht in den Zahlen enthalten sind. Ein- und Aussteigende anderer öffentlicher Verkehrsmittel sowie Passanten werden nicht berücksichtigt. Umsteigende zählen sowohl als Aus- wie als Einsteigende, also zweifach.<br/>
Letzter Update Juni.  2023<br/><br/>
Detaillierte Informationen zu den Bahnhöfen und Haltestellen, beispielsweise deren Koordinaten, finden sich in der Liste der Stations- und Haltestellennamen, publiziert im Auftrag des BAV: https://opentransportdata.swiss/de/dataset/bav_liste ";Mobilität und Verkehr;Verkehr,Passagier,Pendler,Kunden;https://data.sbb.ch/page/licence;;de;de;;2023-12-12T09:42:23.324000+00:00;True;True;2024-02-23T10:16:09+00:00;2024-03-20T02:10:52.202000+00:00;ch_80_3203;True;St. Gallen;Point;"{""coordinates"": [[[9.393443735316396, 47.43454037234187], [9.300860250368714, 47.43454037234187], [9.300860250368714, 47.403929410502315], [9.393443735316396, 47.403929410502315], [9.393443735316396, 47.43454037234187]]], ""type"": ""Polygon""}";SBB Personenverkehr;;10;;;;;;;True;;stgallen;;;;passagierfrequenz
2020-12-03;2020-12-16;Tiefbauamt, Stadt St.Gallen;OGD-Koordinationsstelle St.Gallen;OGD-Koordinationsstelle St.Gallen;opendata@stadt.sg.ch;unregelmässig;;;;;;;;;;stadt-st-gallen;NonCommercialAllowed-CommercialAllowed-ReferenceRequired;Geokoordinaten Velo Zählstellen Stadt St.Gallen;"<p>Der Datensatz zeigt die Geokoordinaten der Velozählstellen der Stadt St.Gallen. Die Zählungsdaten der Zählstellen finden Sie unter: <a href=""https://daten.stadt.sg.ch/explore/dataset/velozahlungen-stadt-stgallen"" target=""_blank"">https://daten.stadt.sg.ch/explore/dataset/velozahlungen-stadt-stgallen</a></p>";Mobilität und Verkehr;Velo,Velodaten,Zählstellen,Fahrrad;CC BY;https://creativecommons.org/licenses/by/4.0/;de;de;Europe/Zurich;2023-12-01T08:24:50.963000+00:00;False;True;2023-12-01T08:24:50.963000+00:00;2023-12-05T13:36:55.048000+00:00;ch_80_3203;True;St. Gallen;Point;"{""coordinates"": [[[9.420322570949793, 47.450226726941764], [9.323999918997288, 47.450226726941764], [9.323999918997288, 47.40376998670399], [9.420322570949793, 47.40376998670399], [9.420322570949793, 47.450226726941764]]], ""type"": ""Polygon""}";Tiefbauamt, Stadt St.Gallen;;21;;;;;;;False;;stgallen;;;opendata.swiss;geokoordinaten-velo-zahlstellen-stadt-stgallen
