2021-03-24;2021-03-24;Entsorgung St.Gallen (esg);OGD-Koordinationsstelle St.Gallen;OGD-Koordinationsstelle St.Gallen;opendata@stadt.sg.ch;keine Aktualisierung vorgesehen;;;;;;;;;;stadt-st-gallen;NonCommercialAllowed-CommercialAllowed-ReferenceRequired;Einzugsgebiet des Kehrichtheizkraftwerk (KHK) St.Gallen;Zum Einzugsgebiet des Kehrichtheizkraftwerkt St.Gallen (KHK St.Gallen) gehören 41 Gemeinden aus den Kantonen St.Gallen, Appenzell Ausserrhoden, Appenzell Innerrhoden und Thurgau. Dieses Einzugsgebiet mit über 200'000 Einwohnern wird als «Abfallregion St.Gallen – Rorschach – Appenzell» bezeichnet, da eine umfassende Zusammenarbeit im Bereich der Abfallbewirtschaftung besteht. Hauptaufgabe des KHK St.Gallen ist die Behandlung brennbarer Abfälle aus der Region. Jedes Jahr werden ca. 75'000 Tonnen Abfall aus Haushalten, Industrie und Gewerbe behandelt.;Raum und Umwelt;Entsorgung,Kehricht,Verbrennung,Abfall,Heizung,Wärme;CC BY;https://creativecommons.org/licenses/by/4.0/;de;de;Europe/Zurich;2023-12-05T13:40:36.703000+00:00;True;True;2021-03-24T17:59:53.499000+00:00;2023-12-05T13:40:47.197000+00:00;world_ch;True;Switzerland;MultiPolygon,Polygon;"{""coordinates"": [[[9.589405171573162, 47.531936410814524], [9.191098557785153, 47.531936410814524], [9.191098557785153, 47.23399365786463], [9.589405171573162, 47.23399365786463], [9.589405171573162, 47.531936410814524]]], ""type"": ""Polygon""}";Entsorgung St.Gallen (esg);https://www.stadt.sg.ch/home/raum-umwelt/abfall-entsorgung/kehrichtheizkraftwerk.html;41;;;;;;;False;;stgallen;;;opendata.swiss;einzugsgebiet-des-kehrichtheizkraftwerk-khk-stgallen
2020-05-21;2020-05-21;Tiefbauamt, Stadt St.Gallen;OGD-Koordinationsstelle St.Gallen;OGD-Koordinationsstelle St.Gallen;opendata@stadt.sg.ch;keine Aktualisierung vorgesehen;;;;;;;;;;stadt-st-gallen;NonCommercialAllowed-CommercialAllowed-ReferenceRequired;Detailpläne und Geokoordinaten MIV Zählstellen Stadt St.Gallen;"<p style='font-family: -apple-system, BlinkMacSystemFont, ""Segoe UI"", Roboto, Helvetica, Arial, sans-serif;'>Dieser Datensatz zeigt sämtliche Detailpläne und Geokoordinaten der Zählstellen des motorisierten Individualverkehrs (MIV) der Stadt St.Gallen. Darin enthalten sind die Pläne zur Erklärung der Richtungsnummern, die Koordinaten im schweizerischen Landeskoordinatensystem LV95, sowie im globalen Koordinatensystem WGS84 (GPS).</p><p style='font-family: -apple-system, BlinkMacSystemFont, ""Segoe UI"", Roboto, Helvetica, Arial, sans-serif;'>Die LV95-Koordinaten stammen aus dem System des städtischen Tiefbauamtes, während zur Umrechnung von LV95 in WGS84 die Transformationsdienste des Bundesamt für Landestopografie swisstopo verwendet wurden: <a href=""https://www.swisstopo.admin.ch/de/karten-daten-online/calculation-services.html"" style='background-color: rgb(255, 255, 255); font-family: -apple-system, BlinkMacSystemFont, ""Segoe UI"", Roboto, Helvetica, Arial, sans-serif; font-size: 0.833rem;'>https://www.swisstopo.admin.ch/de/karten-daten-online/calculation-services.html</a></p>";Mobilität und Verkehr;MIV,Zählstellen,Koordinaten;CC BY;https://creativecommons.org/licenses/by/4.0/;de;de;Europe/Zurich;2023-12-05T13:40:28.196000+00:00;True;True;2021-02-23T09:37:27.602000+00:00;2023-12-05T13:40:46.155000+00:00;ch_80_3203;False;St. Gallen;Point;"{""coordinates"": [[[9.41795895807445, 47.44671173393726], [9.299545800313354, 47.44671173393726], [9.299545800313354, 47.40268817637116], [9.41795895807445, 47.40268817637116], [9.41795895807445, 47.44671173393726]]], ""type"": ""Polygon""}";Tiefbauamt, Stadt St.Gallen;https://www.swisstopo.admin.ch/de/karten-daten-online/calculation-services.html;50;;;;;;;False;;stgallen;;;opendata.swiss;detailplane-und-geokoordinaten-miv-zahlstellen-stadt-stgallen
2021-11-02;2021-11-02;Dienststelle Sport, Stadt St.Gallen;;OGD-Koordinationsstelle St.Gallen;opendata@stadt.sg.ch;alle 15 Minuten;;;;;;;;;;stadt-st-gallen;NonCommercialAllowed-CommercialAllowed-ReferenceRequired;Besucherzahlen in den Frei- und Hallenbäder der Stadt St.Gallen (während Covid-19-Pandemie);"<p>Die Dienststelle Sport hat im Laufe der Corona-Pandemie begonnen, die Besucherinnen und Besucher der Freibäder und Hallenbäder in St.Gallen zu zählen. Dieser Datensatz zeigt diese Zählungen der Firma countee. Sie zeigen den aktuellen Besucherstand zum entsprechenden Zeitpunkt.</p><p>Leider können wir aus lizenztechnischen Gründen nicht alle Besucherbewegungen hier im Portal ausweisen, weshalb wir uns auf viertelstündliche Besucherstände beschränken. Dadurch kann allerdings mit diesem Datensatz nicht auf die genaue Anzahl Besucher pro Tag geschlossen werden. Dafür stellen wir euch die <span style=""font-family: inherit; font-size: 0.875rem;"">Exportlinks des Zählerbetreibers Countee zur Verfügung, welche Analysen mit sämtlichen Besucherbewegungen ermöglichen. Die Exports sind nach folgendem Schema aufgebaut:</span></p><ul><li>Alle Bewegungen: http://countee.ch/exports/&lt;Bad_ID&gt;-&lt;JAHR&gt;.csv</li><li>15min Besucherstand (dieser Datensatz): http://countee.ch/exports/&lt;Bad_ID&gt;-&lt;JAHR&gt;_15min.csv</li><li>Metadaten: http://countee.ch/exports/&lt;Bad_ID&gt;-&lt;JAHR&gt;.csv.meta.txt</li></ul><div><span style=""font-family: inherit; font-size: 0.875rem;""><b>Bad_IDs:</b></span></div><table class=""table table-bordered""><tbody><tr><td>Freibad Rotmonten<br/></td><td>c5ed762037214d<br/></td></tr><tr><td>Familienbad Dreilinden<br/></td><td>c5ed7621c47da1<br/></td></tr><tr><td>Freibad Lerchenfeld<br/></td><td>c5ed7622ecbf1f<br/></td></tr><tr><td>Hallenbad Blumenwies<br/></td><td>c5ed761e9a9100<br/></td></tr><tr><td>Hallenbad Volksbad<br/></td><td>c5ed76249da809<br/></td></tr></tbody></table>";Kultur, Medien, Informationsgesellschaft, Sport,Mobilität und Verkehr;Bäder,Kapazitäten,Besucher,Freibad,Hallenbad;CC BY;https://creativecommons.org/licenses/by/4.0/;de;de;Europe/Zurich;2023-12-21T10:21:46.040000+00:00;True;True;2023-01-04T23:00:31.279000+00:00;2024-03-19T23:00:25.896000+00:00;ch_80_3203;True;St. Gallen;;;Dienststelle Sport, Stadt St.Gallen;https://www.sport.stadt.sg.ch/home/baeder-sauna.html;14582;;;;;;;False;;stgallen;2020,2021;;opendata.swiss;besucherzahlen-freibader-hallenbader-stadt-stgallen
2023-07-06;2023-07-06;Rauminformationszentrum (RIZ), Stadt St.Gallen;;opendata@stadt.sg.ch;;;;;;;;;;;;stadt-st-gallen;NonCommercialAllowed-CommercialAllowed-ReferenceRequired;Ortsbildinventar nach ISOS;<p>Der Datensatz zeigt das Ortsbildinventar nach ISOS mit den Gebiets- und Umgebungszonen.</p>;Bau- und Wohnungswesen,Raum und Umwelt;Ortsbildinventar,Entsieglungspotential;CC BY;https://creativecommons.org/licenses/by/4.0/;de;de;Europe/Zurich;2023-07-06T06:13:10+00:00;False;False;2023-07-11T08:49:50.144000+00:00;2023-12-05T13:48:49.350000+00:00;ch_80_3203;False;St. Gallen;MultiPolygon,Polygon;"{""coordinates"": [[[9.410145683214068, 47.44753714185208], [9.313752707093954, 47.44753714185208], [9.313752707093954, 47.3965254239738], [9.410145683214068, 47.3965254239738], [9.410145683214068, 47.44753714185208]]], ""type"": ""Polygon""}";Rauminformationszentrum (RIZ) Stadt St.Gallen;;112;;;;;;;False;;stgallen;;;opendata.swiss;ortsbildinventar-nach-isos
2020-05-22;2020-10-20;Entsorgung St.Gallen (esg);OGD-Koordinationsstelle St.Gallen;OGD-Koordinationsstelle St.Gallen;opendata@stadt.sg.ch;keine Aktualisierung vorgesehen;;;;;;;;;;stadt-st-gallen;NonCommercialAllowed-CommercialAllowed-ReferenceRequired;Strassen innerhalb St.Galler Abfuhrgebiete (Stand 2023);<p>Der Datensatz zeigt die St.Galler Strassen in den entsprechenden Abfuhrgebieten.</p>;Verwaltung;Entsorgung,Abfall,Strassen,Abfuhr;CC BY;https://creativecommons.org/licenses/by/4.0/;de;de;Europe/Zurich;2023-12-05T13:43:02.008000+00:00;True;True;2023-05-04T12:42:51.552000+00:00;2023-12-05T13:43:08.240000+00:00;ch_80_3203;False;St. Gallen;;;Entsorgung St.Gallen (esg);;690;;;;;;;False;;stgallen;;;opendata.swiss;strassen-innerhalb-stgaller-abfuhrgebiete
;;Entsorgung St.Gallen;;OGD-Koordinationsstelle St.Gallen;opendata@stadt.sg.ch;täglich;;;;;;;;;;stadt-st-gallen;NonCommercialAllowed-CommercialAllowed-ReferenceRequired;Unterflurbehälter Stadt St.Gallen;Standorte der öffentlichen Unterflurcontainer;Raum und Umwelt;;CC BY;https://creativecommons.org/licenses/by/4.0/deed.de;de;de;;2024-01-15T12:31:09+00:00;;;2024-03-20T05:30:26.756000+00:00;2024-03-20T05:30:26.868000+00:00;;;;Point;;Rauminformationszentrum (RIZ) Stadt St.Gallen;https://map.stadt.sg.ch/stadtplan/ext/?lang=de&basemap=sg_av&layers=Unterflurbehaelter;400;;;;;;;False;;stgallen;;;opendata.swiss;unterflurbehalter
2023-04-03;2023-04-03;OGD-Koordinationsstelle St.Gallen;;OGD-Koordinationsstelle St.Gallen;opendata@stadt.sg.ch;;;;;;;;;;;stadt-st-gallen;NonCommercialAllowed-CommercialAllowed-ReferenceRequired;Übersicht Dienstleistungen gegenüber Kundinnen und Kunden der Stadt St.Gallen;<p>Der Datensatz zeigt eine Arbeitsversion einer Übersicht über sämtliche Dienstleistungen, welche die Stadt St.Gallen gegenüber Ihren Kundinnen und Kunden erbringt. Ziel ist es, dass die Dienstleistungen durch Open Data besser auffindbar und durchsuchbar werden und an verschiedenen Orten einer Cutomer Journey integriert werden kann. Die Dienstleistungsübersicht ist Grundlage des erweiterten städtischen Online-Schalters.</p>;Verwaltung;Dienstleistungen,Services,Smart Government;CC BY;https://creativecommons.org/licenses/by/4.0/;de;de;Europe/Zurich;2024-03-20T08:08:29.874000+00:00;True;True;2024-03-20T08:08:29.874000+00:00;2024-03-20T08:08:29.969000+00:00;;False;;;;OGD-Koordinationsstelle St.Gallen;;369;;;;;;;False;;stgallen;;;opendata.swiss;dienstleistungsuebersicht-stadt-stgallen
;;Stadt St.Gallen, Tiefbauamt;;OGD-Koordinationsstelle St.Gallen;opendata@stadt.sg.ch;Änderungen werden laufen aktualisiert;;;;;;;;;;stadt-st-gallen;NonCommercialAllowed-CommercialAllowed-ReferenceRequired;Veloplan Stadt St.Gallen;Infos über Infrastruktur und Velorouten;Mobilität und Verkehr;Velo,Velorouten,Strassen,Bike,Steigung;CC BY;https://creativecommons.org/licenses/by/4.0/deed.de;de;de;;2024-01-15T12:31:07+00:00;;;2024-03-20T05:31:24.719000+00:00;2024-03-20T05:31:24.815000+00:00;;;;LineString;"{""coordinates"": [[[9.44046520628035, 47.45480643119663], [9.289921699091792, 47.45480643119663], [9.289921699091792, 47.39060951862484], [9.44046520628035, 47.39060951862484], [9.44046520628035, 47.45480643119663]]], ""type"": ""Polygon""}";Rauminformationszentrum (RIZ) Stadt St.Gallen;https://map.stadt.sg.ch/stadtplan/ext/?lang=de&basemap=sg_av&layers=veloplan;17261;;;;;;;False;;stgallen;;;opendata.swiss;veloplan
;;Tiefbauamt, Stadt St.Gallen;;OGD-Koordinationsstelle St.Gallen;opendata@stadt.sg.ch;täglich;;;;;;;;;;stadt-st-gallen;NonCommercialAllowed-CommercialAllowed-ReferenceRequired;Parkplätze und Parkhäuser in der Stadt St.Gallen;"<p class=""MsoNormal"">Der Datensatz zeigt die Parkplätze und Parkhäuser der Stadt St.Gallen inklusive der Parkplatzart und der Anzahl Parkplätze.<o:p></o:p></p>";Mobilität und Verkehr;Parkplatz,Parkhaus,Blaue Zone,Weisse Zone;CC BY;https://creativecommons.org/licenses/by/4.0/deed.de;de;de;;2021-11-02T05:30:05+00:00;False;False;2024-03-20T05:35:08.074000+00:00;2024-03-20T05:35:08.182000+00:00;;False;;Point;;Rauminformationszentrum (RIZ) Stadt St.Gallen;https://map.stadt.sg.ch/;2768;;;;;;;False;;stgallen;;;opendata.swiss;parkplatze-und-parkhauser-stadt-stgallen
;;Stadt St.Gallen, Tiefbauamt;;OGD-Koordinationsstelle St.Gallen;opendata@stadt.sg.ch;Änderungen werden laufen aktualisiert;;;;;;;;;;stadt-st-gallen;NonCommercialAllowed-CommercialWithPermission-ReferenceRequired;Begegnungszonen Stadt St.Gallen;Realisierte Begegnungszonen, mit Angabe Gebiet, Nr. und Einführungsdatum;Mobilität und Verkehr,Raum und Umwelt;Fussgänger,Passanten,Langsamverkehr;CC BY;https://creativecommons.org/licenses/by/4.0/;de;de;Europe/Zurich;2024-01-15T12:31:07+00:00;;;2024-03-20T05:30:46.418000+00:00;2024-03-20T05:30:46.540000+00:00;;;;Polygon;"{""coordinates"": [[[9.394275387749076, 47.437833244912326], [9.33313351124525, 47.437833244912326], [9.33313351124525, 47.40129120647907], [9.394275387749076, 47.40129120647907], [9.394275387749076, 47.437833244912326]]], ""type"": ""Polygon""}";Rauminformationszentrum (RIZ) Stadt St.Gallen;https://map.stadt.sg.ch/stadtplan/ext/?lang=de&basemap=sg_av&layers=begegnungszonen;26;;;;;;;False;;stgallen;;;opendata.swiss;begegnungszonen
2020-04-02;2020-04-02;Stadt St.Gallen, Liegenschaften;;OGD-Koordinationsstelle St.Gallen;opendata@stadt.sg.ch;quartalsweise;;;;;;;;;;stadt-st-gallen;NonCommercialAllowed-CommercialAllowed-ReferenceRequired;Städtische Liegenschaften Stadt St.Gallen;;Bau- und Wohnungswesen;;CC BY;https://creativecommons.org/licenses/by/4.0/deed.de;de;de;;2024-01-15T12:31:04+00:00;;;2024-03-20T05:30:38.104000+00:00;2024-03-20T05:30:38.216000+00:00;;;;MultiPolygon,Polygon;"{""coordinates"": [[[9.434714633971453, 47.45096739381552], [9.292169893160462, 47.45096739381552], [9.292169893160462, 47.39515489898622], [9.434714633971453, 47.39515489898622], [9.434714633971453, 47.45096739381552]]], ""type"": ""Polygon""}";Rauminformationszentrum (RIZ) Stadt St.Gallen;https://map.stadt.sg.ch/stadtplan/ext/?lang=de&basemap=sg_av&layers=LI_Stadt;984;;;;;;;False;;stgallen;;;opendata.swiss;stadtische-liegenschaften
2022-01-01;2023-02-15;Stadtkanzlei, Stadt St.Gallen;;OGD-Koordinationsstelle St.Gallen;opendata@stadt.sg.ch;laufend;;;;;;;;;;stadt-st-gallen;NonCommercialAllowed-CommercialAllowed-ReferenceRequired;Bevölkerungsvorstösse Stadt St.Gallen;"<p>Der Datensatz zeigt die eingereichten Bevölkerungsvorstösse in der Stadt St.Gallen. Der Bevölkerungsvorstoss als Partizipationsmittel wurde im Jahr 2021 eingeführt. Sämtliche Einwohnerinnen und Einwohner der Stadt St.Gallen können unabhängig von Alter, Herkunft und staatsbürgerlichem Status, also mit oder ohne Stimmrecht, Anliegen einbringen. Dazu steht ihnen der Bevölkerungsvorstoss zur Verfügung: Mindestens 15 Bewohnerinnen und Bewohner der Stadt St.Gallen, die das 13. Altersjahr zurückgelegt haben, können zu allen Fragen und Themen des politischen Alltags, dem Stadtparlament einen Bevölkerungsvorstoss einreichen (Partizipationsreglement; SRS 141.1).</p>";Politik,Verwaltung;Partizipation,Beteiligung,Teilhabe,Vorstösse;CC BY;https://creativecommons.org/licenses/by/4.0/;de;de;Europe/Zurich;2024-03-19T23:05:36.637000+00:00;False;True;2024-03-19T23:05:36.637000+00:00;2024-03-19T23:05:36.735000+00:00;ch_80_3203;True;St. Gallen;;;Stadtkanzlei, Stadt St.Gallen;https://www.stadt.sg.ch/home/verwaltung-politik/demokratie-politik/partizipation.html;36;;;;;;;False;;stgallen;2022,2023;;opendata.swiss;bevoelkerungsvorstoesse-stadt-stgallen
2023-06-08;;Dienststelle Umwelt und Energie, Stadt St.Gallen;;OGD-Koordinationsstelle St.Gallen;opendata@stadt.sg.ch;unregelmässig;;;;;;;;;;umwelt-und-energie-stadt-st-gallen;NonCommercialAllowed-CommercialAllowed-ReferenceRequired;Kalender Natur findet Stadt;"Kalender-Datensatz zu ""Natur findet Stadt"". Rund 20 Organisationen aus der Stadt und Region bieten über 120 Kurse, Exkursionen oder Führungen für Erwachsene und Kinder an und laden ein, die Natur in und um St.Gallen zu erkunden.";Raum und Umwelt;Natur findet Stadt,Kalender,Botanischer Garten,Naturmuseum;CC BY;https://creativecommons.org/licenses/by/4.0/;de;de;Europe/Zurich;2023-06-08T07:39:54+00:00;False;False;2024-03-11T07:46:48.514000+00:00;2024-03-11T07:46:48.650000+00:00;ch_80_3203;False;St. Gallen;;;Dienststelle Umwelt und Energie, Stadt St.Gallen;https://www.stadt.sg.ch/home/raum-umwelt/natur-landschaft/natur_findet_stadt.html;186;;;;;;;False;;stgallen;;;;kalender-natur-findet-stadt
2019-05-23;2019-09-05;Betreibungsamt, Stadt St.Gallen;;OGD-Koordinationsstelle St.Gallen;opendata@stadt.sg.ch;unregelmässig;;2005 - 2018;;;;;;;;stadt-st-gallen;NonCommercialAllowed-CommercialAllowed-ReferenceRequired;Pfändungen Stadt St.Gallen (2005-2018);<p>Anzahl Pfändungen der Stadt St.Gallen (Jahre 2005-2018)<br/></p>;Finanzen,Arbeit, Erwerb;Betreibung,Pfändung,Schulden,Armut;CC BY;https://creativecommons.org/licenses/by/4.0/;de;de;Europe/Zurich;2019-05-23T15:49:31+00:00;False;False;2019-05-23T15:54:10.198000+00:00;2023-12-21T10:20:54.150000+00:00;ch_80_3203;True;St. Gallen;;;Betreibungsamt Stadt St.Gallen;;14;;;;;;;False;;stgallen;;;opendata.swiss;pfandungen-anzahl-stadt-stgallen
2019-08-26;2019-08-26;Entsorgung St.Gallen (esg);;OGD-Koordinationsstelle St.Gallen;opendata@stadt.sg.ch;daily;;;;;;;;;;stadt-st-gallen;NonCommercialAllowed-CommercialAllowed-ReferenceRequired;Füllstandsensoren Glassammelstellen (Grünglas) Stadt St.Gallen;<p>Die Stadt St.Gallen verfügt über Sensoren in verschiedenen Glassammelstellen der Stadt, welche den Füllstand der Container messen. Dieser Datensatz zeigt die Messwerte der Grünglas-Sammelstellen.<br/></p>;Raum und Umwelt;Sensor,Offene Sensordaten,Füllstand,Entsorgung;CC BY;https://creativecommons.org/licenses/by/4.0/;de;de;Europe/Zurich;2024-03-19T23:02:45.624000+00:00;False;True;2024-03-19T23:02:45.624000+00:00;2024-03-20T20:00:41.341000+00:00;ch_80_3203;True;St. Gallen;Point;;Entsorgung St.Gallen (esg);;907411;;;;;;;False;;stgallen;2020,2021,2022,2023;;opendata.swiss;fuellstandsensoren-glassammelstellen-gruenglas
2020-11-24;2021-04-06;OGD-Koordinationsstelle St.Gallen;;OGD-Koordinationsstelle St.Gallen;opendata@stadt.sg.ch;vierteljährlich;;;;;;;;;;stadt-st-gallen;NonCommercialAllowed-CommercialAllowed-ReferenceNotRequired;Vergaben Stadt St.Gallen grösser CHF 100.000;Im Zusammenhang mit der Beantwortung der Interpellation «Mehr Transparenz im Vergabewesen (Open Data)», (Beschluss Nr. 4211 vom 26. Mai 2020) hat der Stadtrat die Praxis für die Publikation von Vergaben neu geregelt. Ziel ist, eine bessere Transparenz – insbesondere auch bei freihändigen Verfahren – zu ermöglichen. Ab dem 01.01.2021 werden hier daher alle Vergaben der Stadt St.Gallen ab CHF 100.000 als OGD zur Verfügung gestellt.;Finanzen,Preise,Verwaltung;Vergabe;CC BY;https://creativecommons.org/licenses/by/4.0/;de;de;Europe/Zurich;2024-02-01T09:41:20.071000+00:00;True;True;2024-02-01T09:41:20.071000+00:00;2024-02-01T09:41:20.177000+00:00;ch_80_3203;True;St. Gallen;;;OGD-Koordinationsstelle St.Gallen;;331;;;;;;;False;;stgallen;2021;;opendata.swiss;vergaben-stadt-stgallen-grosser-chf-100000
2022-02-22;2022-02-22;Schule und Musik, Stadt St.Gallen;;OGD-Koordinationsstelle St.Gallen;opendata@stadt.sg.ch;unregelmässig;;;;;;;;;;stadt-st-gallen;NonCommercialAllowed-CommercialAllowed-ReferenceRequired;Schulferien und Feiertage Stadt St.Gallen;<p>Der Datensatz zeigt die Daten der Schulferien und Feiertage in der Stadt St.Gallen.</p>;Bildung, Wissenschaft;Ferien,Feiertage,Schule;CC BY;https://creativecommons.org/licenses/by/4.0/;de;de;Europe/Zurich;2024-01-30T09:51:04.666000+00:00;True;True;2024-01-30T09:51:04.666000+00:00;2024-01-30T09:51:04.802000+00:00;;False;;;;Schule und Musik, Stadt St.Gallen;https://www.stadt.sg.ch/home/schule-bildung/Schulferien.html;31;;;;;;;False;;stgallen;2022,2023,2024,2025;;opendata.swiss;schulferien-feiertage-stadt-stgallen
;;Entsorgung St.Gallen;;OGD-Koordinationsstelle St.Gallen;opendata@stadt.sg.ch;täglich;;;;;;;;;;stadt-st-gallen;NonCommercialAllowed-CommercialAllowed-ReferenceRequired;Sammelstellen Stadt St.Gallen;Sammelstellen für Glas, Alu-Dosen, Textilien, Styropor, Altöl und Altmetall;Raum und Umwelt;;CC BY;https://creativecommons.org/licenses/by/4.0/deed.de;de;de;;2024-01-15T12:31:09+00:00;;;2024-03-20T05:30:29.055000+00:00;2024-03-20T05:30:29.163000+00:00;;;;Point;"{""coordinates"": [[[9.424690464511514, 47.44305077008903], [9.295205231755972, 47.44305077008903], [9.295205231755972, 47.40370900835842], [9.424690464511514, 47.40370900835842], [9.424690464511514, 47.44305077008903]]], ""type"": ""Polygon""}";Rauminformationszentrum (RIZ) Stadt St.Gallen;https://map.stadt.sg.ch/stadtplan/ext/?lang=de&basemap=sg_av&layers=sammelstellen;31;;;;;;;False;;stgallen;;;opendata.swiss;sammelstellen
2021-06-01;2022-10-05;Dienststelle Umwelt und Energie, Stadt St.Gallen;;OGD-Koordinationsstelle St.Gallen;opendata@stadt.sg.ch;http://publications.europa.eu/resource/authority/frequency/HOURLY;;;;;;;;;;stadt-st-gallen;NonCommercialAllowed-CommercialAllowed-ReferenceRequired;Fahrtenübersicht Projekt Sankt Pedalo der Stadt St.Gallen (E-Cargobikes für Unternehmen);"<p>Firmen und Organisationen testen während einem Jahr kostenlos ein E-Cargobike und setzen auf umweltfreundliche Mobilität. Das Projekt «Sankt Pedalo» E-Cargobikes für Unternehmen hat die Stadt St.Gallen im Rahmen des Energiekonzepts 2050 initiiert. Der Datensatz zeigt die Lieferungen- und Fahrtenübersicht der teilnehmenden Unternehmen und ermöglicht die Berechnung der CO2-Ersparnis durch das Projekt.</p>
<p><strong>Hinweis: </strong>Beim Wert ""CO2-Ersparnis"" haltet sich um eine theoretische ""Spielerei"", der mit dem Durschnittswert 0.22kg CO2 / gefahrenem km bei einem Verbrennermotor berechnet wird. Das heisst in diesem Projekt führen nur die Fahrten welche das Auto oder einen Lieferwagen ersetzen, zu einer CO2-Ersparnis.</p>";Handel,Mobilität und Verkehr;Cargo,E-Bike,CO2,Lieferwagen,Logistik;CC BY;https://creativecommons.org/licenses/by/4.0/;de;de;Europe/Zurich;2021-11-02T21:39:17+00:00;False;False;2024-03-20T20:01:37.806000+00:00;2024-03-20T20:01:37.900000+00:00;ch_80_3203;True;St. Gallen;;;Dienststelle Umwelt und Energie, Stadt St.Gallen;;475;;;;;;;False;;stgallen;2021,2022;;opendata.swiss;fahrtenubersicht-projekt-sankt-pedalo-stadt-stgallen
2021-07-28;2021-07-28;St.Galler Stadtwerke (sgsw);;OGD-Koordinationsstelle St.Gallen;opendata@stadt.sg.ch;unregelmässig;;;;;;;;;;stadt-st-gallen;NonCommercialAllowed-CommercialAllowed-ReferenceRequired;Solaranlagen der St.Galler Stadtwerke;"<p>Der Datensatz zeigt die Solaranlagen der St.Galler Stadtwerke (sgsw) und deren Eigenschaften.</p><p>Die Anlagen mit smart-me ID und smart-me Name sind Teil des Pilotprojekts Kraftwerk St.Gallen und deren aktuelle Stromproduktion zeigt folgender Datensatz:</p><p><a href=""https://daten.stadt.sg.ch/explore/dataset/aktuelle-stromproduktion-der-solaranlagen-der-stgaller-stadtwerke"" target=""_blank"">https://daten.stadt.sg.ch/explore/dataset/aktuelle-stromproduktion-der-solaranlagen-der-stgaller-stadtwerke</a></p>";Energie;Solar,Strom,PV,Photovoltaik,Sonne,Erneuerbare Energien;CC BY;https://creativecommons.org/licenses/by/4.0/;de;de;Europe/Zurich;2021-07-28T09:39:14.225000+00:00;False;True;2021-07-28T09:39:14.225000+00:00;2023-12-05T13:52:43.150000+00:00;ch_80_3203;True;St. Gallen;Polygon;"{""coordinates"": [[[9.421247513964772, 47.44535097386688], [9.292730977758765, 47.44535097386688], [9.292730977758765, 47.40396394394338], [9.421247513964772, 47.40396394394338], [9.421247513964772, 47.44535097386688]]], ""type"": ""Polygon""}";St.Galler Stadtwerke (sgsw);;35;;;;;;;False;;stgallen;;;opendata.swiss;solaranlagen-der-stgaller-stadtwerke
2020-07-06;2020-07-06;Entsorgung St.Gallen (esg);;OGD-Koordinationsstelle St.Gallen;opendata@stadt.sg.ch;unregelmässig;;2020-2021;;;;;;;;stadt-st-gallen;NonCommercialAllowed-CommercialAllowed-ReferenceRequired;Abfuhrdaten Stadt St.Gallen;"<p>Der Datensatz zeigt die Daten des Entsorgungskalenders in der Stadt St.Gallen. Er enthält die Abfuhrdaten, die Startzeit der Abfuhr, die Art der Sammlung, die Abfuhrgebiete, die dazugehörigen Strassen, sowie das PDF zum physischen Kalender des entsprechenden Abfuhrgebiets. Mit der Filterfunktion in der Tabellenvisualisation kann ganz einfach nach Strasse, Gebiet, Art der Sammlung und Datum gefiltert werden. Weitere Informationen zu Abfall und Entsorgung der Stadt St.Gallen, sowie eine Visualisierung des Datensatzes finden Sie unter: <a href=""https://www.stadt.sg.ch/home/raum-umwelt/abfall-entsorgung/Abfuhrplan.html"" target=""_blank"">https://www.stadt.sg.ch/home/raum-umwelt/abfall-entsorgung/Abfuhrplan.html</a></p>";Verwaltung;Abfall,Entsorgung,Kalender,Sammlung,Kehricht,Grüngut,Papier,Karton,Metall;CC BY;https://creativecommons.org/licenses/by/4.0/;de;de;Europe/Zurich;2023-12-05T16:20:32.244000+00:00;True;True;2023-12-05T16:20:32.244000+00:00;2023-12-05T16:20:33.476000+00:00;ch_80_3203;False;St. Gallen;;;Entsorgung St.Gallen (esg);https://www.stadt.sg.ch/home/raum-umwelt/abfall-entsorgung/Abfuhrplan.html;6334;;;;;;;False;;stgallen;;;opendata.swiss;abfuhrdaten-stadt-stgallen
2021-01-05;2021-01-05;Finanzen, Stadt St.Gallen;OGD-Koordinationsstelle St.Gallen;OGD-Koordinationsstelle St.Gallen;opendata@stadt.sg.ch;jährlich;;;;;;;;;;stadt-st-gallen;NonCommercialAllowed-CommercialAllowed-ReferenceRequired;Budget 2021 der Stadt St.Gallen nach Institutioneller Gliederung;"<p>Der Datensatz zeigt das Budget 2021 der Stadt St.Gallen nach Institutioneller Gliederung. Ebenfalls enthalten sind die Rechnung 2019, das Budget 2020, sowie die Abweichung zum Budget 2021. Eine klickbare Visualisierung des Budgets finden Sie im Tab ""Klickbares Budget"".</p>";Finanzen;Budget,Rechnung,Direktionen,Dienststellen,Haushalt;CC BY;https://creativecommons.org/licenses/by/4.0/;de;de;;2023-12-05T13:41:19.218000+00:00;True;True;2021-01-07T10:09:07.224000+00:00;2023-12-05T13:41:22.159000+00:00;ch_80_3203;True;St. Gallen;;;Finanzen, Stadt St.Gallen;https://www.stadt.sg.ch/home/verwaltung-politik/demokratie-politik/finanzen.html;1782;;;;;;;False;;stgallen;2019,2020,2021;;opendata.swiss;budget-2021-stadt-stgallen-institutionelle-gliederung
