2021-07-28;2022-03-11;Standortförderung, Stadt St.Gallen;;OGD-Koordinationsstelle St.Gallen;opendata@stadt.sg.ch;monatlich;;;;;;;;;;stadt-st-gallen;NonCommercialAllowed-CommercialAllowed-ReferenceRequired;Passantenfrequenz St.Galler Innenstadt (Multergasse);"<p>In der Multergasse, der zentralen Einkaufsstrasse der Stadt St.Gallen, befindet sich seit 2020 ein Sensor der Firma <a href=""http://hystreet.com"" target=""_blank"">hystreet</a>, welcher die Frequenz des Passantenaufkommens erfasst. Der Datensatz zeigt das Passantenaufkommen auf Tagesbasis. Weitere, stündliche Visualisierungsmöglichkeiten finden Sie unter <a href=""https://hystreet.com/locations/298"" target=""_blank"">https://hystreet.com/locations/298</a></p>";Mobilität und Verkehr;Fussgänger,Verkehr,Langsamverkehr,Passanten,Sensor,Standortförderung;CC BY;https://creativecommons.org/licenses/by/4.0/;de;de;Europe/Zurich;2024-02-01T08:49:41.225000+00:00;True;True;2024-02-01T08:49:41.225000+00:00;2024-02-01T08:49:41.332000+00:00;ch_80_3203;True;St. Gallen;;;Standortförderung, Stadt St.Gallen;https://hystreet.com/locations/298;1260;hystreet.com;;;;;;False;;stgallen;;;opendata.swiss;fussganger-stgaller-innenstadt-multergasse
2023-01-03;2023-01-03;St.Galler Stadtwerke (sgsw);;OGD-Koordinationsstelle St.Gallen;opendata@stadt.sg.ch;monthly;;;;;;;;;;stadt-st-gallen;NonCommercialAllowed-CommercialAllowed-ReferenceRequired;Gas- und Fernwärmepreise der St.Galler Stadtwerke im Vergleich zum Ölpreis;"<p class=""MsoListParagraph"">Anhand dieser Datensätze können Sie verschiedene
Energieträger resp. -produkte (Gas- und Fernwärme) der St.Galler Stadtwerke
beliebig mit dem Ölpreis am Lieferstandort der Stadt St.Gallen und den
gasversorgten Gebieten (Abtwil, Arbon, Horn, Mörschwil, Steinach und Rorschach)
miteinander vergleichen. Damit dieser Preisvergleich auch korrekt durchgeführt
werden kann, sind bei den Energieträgern alle Kostenbestandteile (z.B. Grund-
und Arbeitspreise) inkl. der CO2-Abgabe und der Mehrwertsteuer eingerechnet. Sie
können somit beliebige Energieträger in verschiedenen Zeitreihen miteinander
vergleichen.<o:p></o:p></p>";Energie;Erdgas,Gas,Fernwärme,Biogas,Gaspreis;CC BY;https://creativecommons.org/licenses/by/4.0/;de;de;Europe/Zurich;2023-01-04T10:38:04+00:00;False;False;2024-03-19T23:00:56.857000+00:00;2024-03-19T23:00:56.964000+00:00;;False;;;;St.Galler Stadtwerke (sgsw);https://www.sgsw.ch/home/gas.html;6376;;;;;;;False;;stgallen;ab 1966;;opendata.swiss;gas-und-fernwaermepreise-der-stgaller-stadtwerke
2022-11-10;2022-11-10;OGD-Koordinationsstelle St.Gallen;;OGD-Koordinationsstelle St.Gallen;opendata@stadt.sg.ch;;;;;;;;;;;stadt-st-gallen;NonCommercialAllowed-CommercialAllowed-ReferenceRequired;[Arbeitsversion] Dienstleistungübersicht Stadt St.Gallen (Stand 2022);<p>Der Datensatz zeigt eine Arbeitsversion einer Übersicht über sämtliche Dienstleistungen, welche die Stadt St.Gallen gegenüber Ihren Kundinnen und Kunden erbringt. Ziel ist es, dass die Dienstleistungen durch Open Data besser auffindbar und durchsuchbar werden und an verschiedenen Orten einer Customer Journey integriert werden kann.</p><p>Am Open Data Hack 2022 ist der Datensatz Grundlage einer Challenge, die sich mit dem Ausbau der Informationen und der Visualisierung einer solchen Dienstleistungsübersicht beschäftigt, weshalb der Datensatz bereits als Arbeitsversion veröffentlicht wurde.</p>;Verwaltung;Dienstleistungen,Services,Smart Government,Open Data Hack St.Gallen;CC BY;https://creativecommons.org/licenses/by/4.0/;de;de;Europe/Zurich;2023-12-12T15:16:37.235000+00:00;True;True;2023-07-25T11:34:21.436000+00:00;2023-12-12T15:16:42.817000+00:00;;False;;;;OGD-Koordinationsstelle St.Gallen;;328;;;;;;;False;;stgallen;;;;uebersicht-dienstleistungen-stadt-st-gallen-arbeitsversion
;;Entsorgung St.Gallen;;OGD-Koordinationsstelle St.Gallen;opendata@stadt.sg.ch;täglich;;;;;;;;;;stadt-st-gallen;NonCommercialAllowed-CommercialAllowed-ReferenceRequired;Sperrgutmarken Verkauf Stadt St.Gallen;Verkaufsstellen von Gebührenmarken für Sperrgut;Raum und Umwelt;;CC BY;https://creativecommons.org/licenses/by/4.0/deed.de;de;de;;2024-01-15T12:31:05+00:00;;;2024-03-20T05:30:32.830000+00:00;2024-03-20T05:30:32.928000+00:00;;;;Point;;Rauminformationszentrum (RIZ) Stadt St.Gallen;https://map.stadt.sg.ch/stadtplan/ext/?lang=de&basemap=sg_av&layers=Sperrgutmarken;34;;;;;;;False;;stgallen;;;opendata.swiss;sperrgutmarken-verkauf
2019-10-27;2019-11-11;Tiefbauamt, Stadt St.Gallen;;OGD-Koordinationsstelle St.Gallen;opendata.stadt.sg.ch;jährlich;;;;;;;;;;stadt-st-gallen;NonCommercialAllowed-CommercialAllowed-ReferenceRequired;Verkehrszählung MIV Stadt St.Gallen (2018-2022);"<div>Das Tiefbauamt der Stadt St.Gallen zählt den Motorisierten Individualverkehr (MIV) an verschiedenen Orten der Stadt. Dieser Datensatz zeigt die MIV-Verkehrsdaten aus sämtlichen städtischen Zählstellen und wird jährlich aktualisiert.</div><div><br/></div><div>Die Daten der Zählstellen wurden vom Tiefbauamt bereits plausibilisiert. Die Richtungsnummer (RI) kann aus den Detailplänen der Zählstellen herausgelesen werden: <a href=""https://daten.stadt.sg.ch/explore/dataset/detailplane-und-geokoordinaten-miv-zahlstellen-stadt-stgallen"" target=""_blank"">https://daten.stadt.sg.ch/explore/dataset/detailplane-und-geokoordinaten-miv-zahlstellen-stadt-stgallen</a></div><div><br/></div><div><span style=""font-size: 0.875rem;"">Unter folgendem Link finden Sie eine Visualisierung der Verkehrszähldaten inkl. Visualisierung der Detailpläne: </span><a href=""https://www.stadt.sg.ch/home/mobilitaet-verkehr/verkehrspolitik/verkehrszaehlung/opendata_miv.html"" target=""_blank"">https://www.stadt.sg.ch/home/mobilitaet-verkehr/verkehrspolitik/verkehrszaehlung/opendata_miv.html</a></div><div><b style=""font-size: 0.875rem;""><br/></b></div><div><b style=""font-size: 0.875rem;"">Datenstruktur:</b><br/></div><ul><li><i>ORT-ID:</i> ID der Zählstelle</li><li><i>BEZEICHNUNG</i>: Name/Ort der Zählstelle</li><li><i>DATUM</i></li><li><i>WOCHENTAG</i></li><li><i>RI</i>: Richtungsnummer der Messung. Die Daten zeigen eine Zeile pro Richtungsnummer. Die Bedeutung der Richtungsnummer kann den Zählstellen-<a href=""https://daten.stadt.sg.ch/explore/dataset/detailplane-und-geokoordinaten-miv-zahlstellen-stadt-stgallen"" target=""_blank"">Detailplänen </a>entnommen werden.</li><li><i>1 - 24</i>: Uhrzeit (Stunde), wann die Anzahl Fahrzeuge gemessen wurde.<br/>Anmerkung: Durchgehende Nullen für eine spezifische Richtungsnummer bedeuten, dass diese Richtungsnummer für die entsprechende Zählstelle nicht gebraucht wird.</li><li><i>TAGESTOTAL: </i>Anzahl gemessene Fahrzeuge pro Richtung (=Summe 1-24)</li></ul>";Mobilität und Verkehr;MIV,Zählstellen,Auto,Verkehr,Zählung;CC BY;https://creativecommons.org/licenses/by/4.0/;de;de;Europe/Zurich;2023-12-05T13:45:03.684000+00:00;True;True;2023-12-05T13:45:03.684000+00:00;2023-12-05T13:45:03.762000+00:00;ch_80_3203;False;St. Gallen;Point;"{""coordinates"": [[[9.41795895807445, 47.44671173393726], [9.299545800313354, 47.44671173393726], [9.299545800313354, 47.40268817637116], [9.41795895807445, 47.40268817637116], [9.41795895807445, 47.44671173393726]]], ""type"": ""Polygon""}";Tiefbauamt, Stadt St.Gallen;https://www.stadt.sg.ch/home/mobilitaet-verkehr/verkehrspolitik/verkehrszaehlung.html;269601;;;;;;;False;;stgallen;2018,2019,2020,2021,2022;;opendata.swiss;verkehrszahlung-miv-stadt-stgallen
2023-08-15;2023-08-15;St.Galler Stadtwerke (sgsw);;OGD-Koordinationsstelle St.Gallen;opendata@stadt.sg.ch;;;;;;;;;;;stadt-st-gallen;NonCommercialAllowed-CommercialAllowed-ReferenceRequired;Fernwärmestrategie der Stadt St.Gallen (Hestia);"<p class=""MsoNormal""><font face=""Arial, sans-serif""><span style=""font-size: 13.3333px;"">Mit diesem Datenset ist es möglich, für jede Adresse das entsprechende Gebiet der städtischen Wärmeversorgungsstrategie sowie den voraussichtlichen Zeitpunkt der Einführung von Fernwärme (falls geplant) einzusehen. Die Daten umfassen die geplanten Ausbauphasen 3 und 4 </span></font><span style=""font-family: Arial, sans-serif; font-size: 10pt;"">der Fernwärme</span><span style=""font-size: 13.3333px; font-family: Arial, sans-serif;"">, über die voraussichtlich im November 2023 die städtische Stimmbevölkerung abstimmen wird.</span></p>";Raum und Umwelt;sgsw,Energy Hackdays,Wärmeversorgung,Gasversorgung;CC BY;https://creativecommons.org/licenses/by/4.0/;de;de;Europe/Zurich;2023-08-15T13:35:07+00:00;False;False;2023-08-21T14:57:56.453000+00:00;2023-12-28T07:50:48.454000+00:00;ch_80_3203;False;St. Gallen;Point;;St.Galler Stadtwerke (sgsw);;11007;;;;;;;False;;stgallen;;;opendata.swiss;hestia-fernwaermestrategie
;;Tiefbauamt, Stadt St.Gallen;;OGD-Koordinationsstelle St.Gallen;opendata@stadt.sg.ch;täglich;;real-time data;;;;;;;;stadt-st-gallen;NonCommercialAllowed-CommercialAllowed-ReferenceRequired;Aktuelle Baustellen Stadt St.Gallen;Aufzeigen der aktuellen Baustellen auf dem städt. Gebiet;Mobilität und Verkehr;Baustellen,Verkehr;CC BY;https://creativecommons.org/licenses/by/4.0/deed.de;de;de;;2024-01-15T12:31:07+00:00;;;2024-03-20T05:30:22.681000+00:00;2024-03-20T05:30:22.811000+00:00;;;;MultiPolygon,Polygon;"{""coordinates"": [[[9.415683690458536, 47.44282148312777], [9.292312050238252, 47.44282148312777], [9.292312050238252, 47.40354468114674], [9.415683690458536, 47.40354468114674], [9.415683690458536, 47.44282148312777]]], ""type"": ""Polygon""}";Rauminformationszentrum (RIZ) Stadt St.Gallen;https://map.stadt.sg.ch/stadtplan/ext/?lang=de&basemap=sg_av&layers=Baustellen;47;;;;;;;False;;stgallen;;;opendata.swiss;aktuelle-baustellen
2023-07-04;2023-07-04;Rauminformationszentrum (RIZ), Stadt St.Gallen;;;opendata@stadt.sg.ch;;;;;;;;;;;stadt-st-gallen;NonCommercialAllowed-CommercialAllowed-ReferenceRequired;Parkplätze und Parkflächen der Stadt St.Gallen;Der Datensatz zeigt die öffentlichen Parkflächen in der Stadt St.Gallen.;Mobilität und Verkehr;Auto,parkieren,Parkplatz,Verkehr;CC BY;https://creativecommons.org/licenses/by/4.0/;de;de;Europe/Zurich;2023-07-05T12:08:13.255000+00:00;False;True;2023-07-05T12:08:13.255000+00:00;2024-02-29T14:26:18.258000+00:00;ch_80_3203;False;St. Gallen;Polygon;"{""coordinates"": [[[9.427419109269977, 47.449262430891395], [9.294176520779729, 47.449262430891395], [9.294176520779729, 47.39923001267016], [9.427419109269977, 47.39923001267016], [9.427419109269977, 47.449262430891395]]], ""type"": ""Polygon""}";Rauminformationszentrum (RIZ) Stadt St.Gallen;;3232;;;;;;;False;;stgallen;;;opendata.swiss;ppv-parkflaeche
2021-09-17;2021-09-17;Eidgenössische Materialprüfungs- und Forschungsanstalt EMPA;OGD-Koordinationsstelle St.Gallen;OGD-Koordinationsstelle St.Gallen;opendata@stadt.sg.ch;keine Aktualisierung vorgesehen;;;;;;;;;;stadt-st-gallen;NonCommercialAllowed-CommercialAllowed-ReferenceRequired;Material- und Energieflüsse Schweiz und St.Gallen (EMPA MATCH) Synthese 2020 Entsorgungswege (Tonnen & CO2eq);"<p style='font-family: -apple-system, BlinkMacSystemFont, ""Segoe UI"", Roboto, Helvetica, Arial, sans-serif;'>Der Datensatz zeigt die Material- und Energieflüsse der Entsorgungswege der Schweiz aus dem MatCH Synthesebericht der Eidgenössische Materialprüfungs- und Forschungsanstalt (EMPA), in dem u.a. die Umweltbelastung (Tonnen &amp; CO2) der Wirtschaftssektoren berechnet wird.</p><p style='font-family: -apple-system, BlinkMacSystemFont, ""Segoe UI"", Roboto, Helvetica, Arial, sans-serif;'>Der Datensatz wurde aus dem Synthesebericht 2018 erstellt und für die <a href=""https://energydatahackdays.ch/#c2391_self"" target=""_blank"">Energy Hackdays 2021</a> aufbereitet. Daraus entstand eine Anwendung zum Thema ""Klimaneutrale Städte"". Mehr Infos dazu: <a href=""https://energydatahackdays.ch/#c2391_self"" style=""color: rgb(35, 82, 124); text-decoration: underline; outline: 0px;"" target=""_blank"">https://hack.opendata.ch/project/745</a></p><p style='font-family: -apple-system, BlinkMacSystemFont, ""Segoe UI"", Roboto, Helvetica, Arial, sans-serif;'>Mehr Infos zum Projekt MatCH und zu den verschiedenen Berichten finden Sie unter folgenden Ressourcen:<br/><a href=""https://www.empa.ch/web/s506/care-project-match"" target=""_blank"">MatCH Projekt Informationen</a><br/><a href=""https://www.empa.ch/documents/56122/728861/MatCH_Synthese_Bericht/22c48930-bc8e-4ebc-b899-6e189be39667"" style=""background-color: rgb(255, 255, 255); font-size: 0.875rem;"" target=""_blank"">Bericht - Synthesis: The Swiss Economy</a><br/><a href=""https://www.empa.ch/documents/56122/728861/MatCH_Bericht_Bau_v8_161017.pdf/3a733b91-ab69-43cd-ad81-2b6817716eff"" style=""background-color: rgb(255, 255, 255); font-size: 0.875rem;"" target=""_blank"">Bericht - Building sector</a><span style=""font-family: inherit; font-size: 0.875rem;""> <br/></span><a href=""https://www.empa.ch/documents/56122/728861/MatCH_Mobilitaet_Bericht_170913.pdf/96d1cb72-fdf1-4f0a-af24-214d5e0a452a"" style=""background-color: rgb(255, 255, 255); font-size: 0.875rem;"" target=""_blank"">Bericht - Mobility sector</a><br/><a href=""https://www.empa.ch/documents/56122/728861/MatCH_ProduktionKonsum_Bericht_181024.pdf/ef576a3a-fcfa-4f58-9b21-1f05ff82efbd"" style=""background-color: rgb(255, 255, 255); font-size: 0.875rem;"" target=""_blank"">Bericht - Production and consumption sector</a></p>";Energie,Bau- und Wohnungswesen,Industrie, Dienstleistungen,Raum und Umwelt,Mobilität und Verkehr,Volkswirtschaft;Entsorgung,Material,Umweltbelastung,CO2,Sektor,Energy Hackdays;CC BY;https://creativecommons.org/licenses/by/4.0/;de;de;Europe/Zurich;2021-09-17T13:42:14+00:00;False;False;2021-09-23T07:49:37.763000+00:00;2023-12-05T13:52:24.168000+00:00;ch_80_3203;True;St. Gallen;;;Eidgenössische Materialprüfungs- und Forschungsanstalt EMPA;https://www.empa.ch/web/s506/care-project-match;285;;;;;;;False;;stgallen;2018;;opendata.swiss;empa-match-synthese-2020-entsorgungswege-tonnen-co2
;;Stadt St.Gallen, Geomatik und Vermessung;;OGD-Koordinationsstelle St.Gallen;opendata@stadt.sg.ch;;;;;;;;;;;stadt-st-gallen;NonCommercialAllowed-CommercialAllowed-ReferenceRequired;Wohnviertel der Stadt St.Gallen (Statistische Quartiere);Wohnviertel;Raum und Umwelt,Statistische Grundlagen;Quartiere,Stadtteil,Viertel,Statistik,Stadtkreis;CC BY;https://creativecommons.org/licenses/by/4.0/deed.de;de;de;;2024-01-15T12:31:03+00:00;;;2024-03-20T05:31:04.602000+00:00;2024-03-20T05:31:04.726000+00:00;;;;Polygon;"{""coordinates"": [[[9.435247471556067, 47.45307338889688], [9.291513757780194, 47.45307338889688], [9.291513757780194, 47.39515489898622], [9.435247471556067, 47.39515489898622], [9.435247471556067, 47.45307338889688]]], ""type"": ""Polygon""}";Rauminformationszentrum (RIZ) Stadt St.Gallen;https://map.stadt.sg.ch/stadtplan/ext/?lang=de&basemap=sg_av&layers=Wohnviertel;31;;;;;;;False;;stgallen;;;opendata.swiss;wohnviertel
2021-11-03;2021-11-03;Wälli AG Ingenieure;;OGD-Koordinationsstelle St.Gallen;opendata@stadt.sg.ch;keine Aktualisierung vorgesehen;;;;;;;;;;stadt-st-gallen;NonCommercialAllowed-CommercialAllowed-ReferenceRequired;Fussgängerstreifen in der Stadt St.Gallen;<p>Der Datensatz zeigt die Fussgängerstreifen in der Stadt St.Gallen. Die Datengrundlage wird nicht aktualisiert sondern wurde für den Open Data Hack St.Gallen 2021 aufgeschaltet.</p>;Mobilität und Verkehr;Fussgänger,Zebrastreifen,Passanten,Fussverkehr,Open Data Hack St.Gallen;CC BY;https://creativecommons.org/licenses/by/4.0/;de;de;Europe/Zurich;2021-11-04T09:58:34.860000+00:00;False;True;2021-11-04T09:58:34.860000+00:00;2023-12-05T13:50:53.647000+00:00;ch_80_3203;True;St. Gallen;Point;;Wälli AG Ingenieure;;586;;;;;;;False;;stgallen;;;opendata.swiss;fussgangerstreifen-stadt-stgallen
2022-11-08;2022-11-08;Stadtkanzlei, Stadt St.Gallen;OGD-Koordinationsstelle St.Gallen;OGD-Koordinationsstelle St.Gallen;opendata@stadt.sg.ch;täglich;;;;;;;;;;stadt-st-gallen;NonCommercialAllowed-CommercialAllowed-ReferenceRequired;Traktandierte Geschäfte in Sitzungen des Stadtparlaments St.Gallen (RIS - Ratsinformationssytem);"<p>Der Datensatz ist Teil des Ratsinformationssystem (RIS) der Stadt St.Gallen. Er zeigt sämtliche Sitzungen des Stadtparlaments St.Gallen mit den entsprechenden traktandierten Geschäften. Den Sitzungen ist ein Downloadlink zum Protokoll und zu sämtlichen Dokumenten zugeordnet. Den einzelnen traktandierten Geschäften sind neben einem Downloadlink zum Traktandum, die Aktenplannummer, der Geschäftstyp, die Person, sowie die Partei zugeordnet. <span style=""font-size: 0.875rem;"">Mit der Suchfunktion und den Filtern auf der linken Seite können sämtliche Sitzungen und Geschäfte durchforstet und die Traktanden</span><span style=""font-family: inherit; font-size: 0.875rem;""> bspw. nach Themen (Aktenplannummer) oder Partei- oder Personenzugehörigkeit gefiltert werden.</span></p>
<p>Der Datensatz wurde aus verschiedenen Exporten erstellt und auch die Downloadlinks und Links zur Webseite (Sitzungen, Protokolle oder Traktanden) wurden automatisch generiert, weshalb einige allenfalls nicht funktionieren. Wenn Sie solche oder andere Unstimmigkeiten feststellen, bitten wir um eine Kontaktaufnahme.</p>";Politik,Verwaltung;RIS,Ratsinformationssystem,Sitzung,Parlament,Geschäfte,Vorstösse;CC BY;https://creativecommons.org/licenses/by/4.0/;de;de;Europe/Zurich;2024-03-19T23:10:31.845000+00:00;False;True;2024-03-19T23:10:31.845000+00:00;2024-03-19T23:10:31.942000+00:00;ch_80_3203;True;St. Gallen;;;Stadtkanzlei, Stadt St.Gallen;https://www.stadt.sg.ch/home/verwaltung-politik/demokratie-politik/stadtparlament.html;4152;;;;;;;False;;stgallen;;;opendata.swiss;traktandierte-geschaefte-sitzungen-stadtparlament-stgallen
2021-01-06;2021-01-06;OGD-Koordinationsstelle St.Gallen;;OGD-Koordinationsstelle St.Gallen;opendata@stadt.sg.ch;keine Aktualisierung vorgesehen;;;;;;;;;;stadt-st-gallen;NonCommercialAllowed-CommercialAllowed-ReferenceRequired;Organigramm Stadt St.Gallen (Stand Januar 2021);<p>Der Datensatz zeigt das Organigramm der Stadt St.Gallen. Eine Übersicht aller Direktionen mit den dazugehörigen Dienststellen, sowie den entsprechenden Kurzbezeichnungen. Unter Referenzen finden Sie den Link zum visuell dargestellten Organigramm.</p>;Verwaltung;Organigramm,Direktionen,Dienststellen;CC BY;https://creativecommons.org/licenses/by/4.0/;de;de;;2023-12-21T13:38:01.088000+00:00;True;True;2021-03-31T18:29:03.615000+00:00;2023-12-21T13:38:09.699000+00:00;ch_80_3203;True;St. Gallen;;;OGD-Koordinationsstelle St.Gallen;https://www.stadt.sg.ch/home/verwaltung-politik/direktionen/_jcr_content/TeaserPar1/stsg_teaser_download/DownloadListPar/download.ocFile/Stadt%20SG%20Organigramm%20A4%2020191212.pdf;41;;;;;;;False;;stgallen;;;opendata.swiss;organigramm-stadt-stgallen
2021-11-03;2021-11-03;Streetwise;;OGD-Koordinationsstelle St.Gallen;opendata@stadt.sg.ch;keine Aktualisierung vorgesehen;;;;;;;;;;stadt-st-gallen;NonCommercialAllowed-CommercialAllowed-ReferenceRequired;Wahrgenommene Sicherheit der Strassen in der Stadt St.Gallen (Streetwise);"<p>Der Datensatz zeigt die wahrgenommene Sicherheit der Strassen in der Stadt St.Gallen. Die Daten basieren auf einer Analyse von Streetwise, welche mittels Algorithmus Fotos der Strassenabschnitte nach ihrer Sicherheitswahrnehmung analysieren. Mehr Informationen unter: <a href=""https://streetwise.space/"" target=""_blank"">https://streetwise.space/</a></p>";Mobilität und Verkehr,Öffentliche Ordnung und Sicherheit;Sicherheit,Wahrnehmung,Foto,Algorithmus,Strassen;CC BY;https://creativecommons.org/licenses/by/4.0/;de;de;Europe/Zurich;2021-11-05T08:53:10.024000+00:00;False;True;2021-11-05T08:53:10.024000+00:00;2023-12-05T13:50:47.346000+00:00;ch_40_15,ch_40_17;True;Appenzell Ausserrhoden,St. Gallen;Point;"{""coordinates"": [[[9.43525635637343, 47.45961068663746], [9.29092912003398, 47.45961068663746], [9.29092912003398, 47.39083918277174], [9.43525635637343, 47.39083918277174], [9.43525635637343, 47.45961068663746]]], ""type"": ""Polygon""}";Streetwise;https://streetwise.space/;867;;;;;;;False;;stgallen;;;opendata.swiss;wahrgenommene-sicherheit-stadt-stgallen-streetwise
;;;;;;;;;;;;;;;;stadt-st-gallen;NonCommercialAllowed-CommercialAllowed-ReferenceRequired;Car journeys Geneva - St.Gallen (January/February 2018);"<div><div>This dataset shows the estimated number of distinct mobile devices that travelled via motorway between Geneva and St.Gallen during a particular time period for a week at the end of January/beginning of February 2018. The time period is from 29 January 2018 to 4 February 2018. The timespan is 10 minutes. The route is divided into 1,000 m street segments, and each segment is identified by the coordinates of the start and end point.</div> <div>If fewer than 20 mobile phones were counted for a combination of timespan and street segment, the value is listed as ‘&lt;20’ for data protection reasons.</div></div>";Mobilität und Verkehr;Auto,Verkehr,Autobahn;CC BY-NC-SA;https://creativecommons.org/licenses/by-nc-sa/4.0/;de;de;Europe/Zurich;2019-05-23T16:07:50+00:00;;;2018-07-07T11:24:23.796000+00:00;2024-03-20T02:10:51.099000+00:00;world_ch;True;Switzerland;Point;"{""coordinates"": [[[9.637915100902319, 47.53221976105124], [6.125343292951584, 47.53221976105124], [6.125343292951584, 46.242613666690886], [9.637915100902319, 46.242613666690886], [9.637915100902319, 47.53221976105124]]], ""type"": ""Polygon""}";Swisscom (Schweiz) AG;;385056;;;;;;;True;;stgallen;;;;autofahrten-genf-stgallen-januarfebruar-2018
2019-05-25;2019-05-25;Stadtkanzlei, Stadt St.Gallen;;OGD-Koordinationsstelle St.Gallen;opendata@stadt.sg.ch;unregelmässig;;2017-2019;;;;;;;;stadt-st-gallen;NonCommercialAllowed-CommercialAllowed-ReferenceRequired;Abstimmungsresultate Stadt St.Gallen 2017-2019;"<p>Der Datensatz zeigt die Anzahl Stimmen<span style=""font-size: 0.833rem;""> </span><span style=""font-size: 0.833rem;"">(</span><span style=""font-size: 0.833rem;"">Ja, Nein, leer, </span><span style=""font-family: inherit; font-size: 0.833rem;"">gültig, ungültig), sowie die Stimmbeteiligung </span><span style=""font-family: inherit; font-size: 0.833rem;"">der Abstimmungen</span><span style=""font-family: inherit; font-size: 0.833rem;""> der Jahre 2017 bis 2019 in der Stadt St.Gallen.</span></p>";Politik,Verwaltung;Abstimmungen,Resultate;CC BY;https://creativecommons.org/licenses/by/4.0/;de;de;Europe/Zurich;2019-05-25T21:15:48+00:00;False;False;2020-05-07T08:52:57.861000+00:00;2023-12-05T13:53:52.619000+00:00;ch_80_3203;True;St. Gallen;;;Stadtkanzlei, Stadt St.Gallen;;47;;;;;;;False;;stgallen;;;opendata.swiss;abstimmungsresultate-stadt-stgallen-2017-2020
2019-10-22;2019-10-22;Tiefbauamt, Stadt St.Gallen;;OGD-Koordinationsstelle St.Gallen;opendata@stadt.sg.ch;vierteljährlich;;Juli 2011 - August 2019;;;;;;;;stadt-st-gallen;NonCommercialAllowed-CommercialAllowed-ReferenceRequired;Velozählungen Stadt St.Gallen ab 2016;<p>Seit dem Jahr 2016 zählt die Stadt St.Gallen Velofahrer an verschiedenen Zählstellen in der Stadt. Die Zahlen beziehen sich auf die Anzahl Velofahrer pro Stunde in beide Richtungen.</p>;Mobilität und Verkehr;Velo,Verkehr,Velodaten;CC BY;https://creativecommons.org/licenses/by/4.0/;de;de;Europe/Zurich;2023-12-01T08:43:28.070000+00:00;False;True;2023-12-01T08:43:28.070000+00:00;2024-03-08T08:41:13.450000+00:00;ch_80_3203;True;St. Gallen;Point;"{""coordinates"": [[[9.420322570949793, 47.450226726941764], [9.323999918997288, 47.450226726941764], [9.323999918997288, 47.40376998670399], [9.420322570949793, 47.40376998670399], [9.420322570949793, 47.450226726941764]]], ""type"": ""Polygon""}";Tiefbauamt, Stadt St.Gallen;;955800;;;;;;;False;;stgallen;;;opendata.swiss;velozahlungen-stadt-stgallen
2019-08-31;2019-09-05;Betreibungsamt, Stadt St.Gallen;;OGD-Koordinationsstelle St.Gallen;opendata@stadt.sg.ch;unregelmässig;;2005 - 2018;;;;;;;;stadt-st-gallen;NonCommercialAllowed-CommercialAllowed-ReferenceRequired;Ausgestellte Verlustscheine Stadt St.Gallen (2005-2018);<p>Anzahl ausgestellter Verlustscheine der Stadt St.Gallen (Anzahl und in Mio., Jahre 2005-2018)</p>;Finanzen,Arbeit, Erwerb;Betreibung,Finanzen,Verlust;CC BY;https://creativecommons.org/licenses/by/4.0/;de;de;Europe/Zurich;2019-05-23T16:02:27+00:00;False;False;2019-08-31T14:43:25.009000+00:00;2023-12-21T10:19:42.718000+00:00;ch_80_3203;True;St. Gallen;;;Betreibungsamt Stadt St.Gallen;;14;;;;;;;False;;stgallen;;;opendata.swiss;ausgestellte-verlustscheine-anzahl-stadt-stgallen
;;Stadt St.Gallen, Tiefbauamt;;OGD-Koordinationsstelle St.Gallen;opendata@stadt.sg.ch;Änderungen werden laufen aktualisiert;;;;;;;;;;stadt-st-gallen;NonCommercialAllowed-CommercialAllowed-ReferenceRequired;Gemeindestrassenplan Stadt St.Gallen;Klassierung der Strassen, Trottoirs und Wege;Mobilität und Verkehr;Gemeindestrassenplan,Strassenplan;CC BY;https://creativecommons.org/licenses/by/4.0/deed.de;de;de;;2024-01-15T12:31:08+00:00;;;2024-03-20T05:30:43.713000+00:00;2024-03-20T05:30:43.900000+00:00;;;;Polygon;"{""coordinates"": [[[9.435136914253235, 47.45288697537035], [9.291526079177856, 47.45288697537035], [9.291526079177856, 47.39515489898622], [9.435136914253235, 47.39515489898622], [9.435136914253235, 47.45288697537035]]], ""type"": ""Polygon""}";Rauminformationszentrum (RIZ) Stadt St.Gallen;https://map.stadt.sg.ch/stadtplan/ext/?lang=de&basemap=sg_av&layers=gemeindestrassenplan;1617;;;;;;;False;;stgallen;;;opendata.swiss;gemeindestrassenplan
